{
  "$schema": "./docs/guild.config.schema.json",
  "language": "en",
  "guild": {
    "name": "AI Guild",
    "tagline": "Your AI companions and tools, in one place.",
    "description": "A private, game-style catalog of your AI environment."
  },
  "player": {
    "name": "Player",
    "avatar": "/art/player.webp"
  },
  "timezone": "UTC",
  "machines": [
    { "id": "main", "label": "This machine", "kind": "local" }
  ],
  "theme": {
    "preset": "lavender-toybox",
    "colors": {
      "ink": "#302449",
      "muted": "#756984",
      "paper": "#ffffff",
      "surface": "#f5f0fc",
      "surface2": "#ede3fc",
      "line": "#e7e1f1",
      "accent": "#7048de",
      "accentDark": "#5131b1",
      "warm": "#ff936e",
      "gold": "#f2c565",
      "edge": "#d7cdec",
      "shadow": "#b8a9d4"
    },
    "font": "Inter, \"Hiragino Sans\", \"Noto Sans JP\", system-ui, sans-serif",
    "darkPanel": "#2e1d64"
  },
  "art": {
    "style": "premium polished soft 3D toy-like illustration, white backdrop, lavender and deep-purple accents, coral only as a tiny detail",
    "characterConcept": "cute animal companions, each holding one tool that shows their job",
    "subjects": [
      "elephant archivist with a compass",
      "red panda engineer with a tiny wrench",
      "owl analyst with a telescope",
      "beaver builder with a blueprint",
      "fennec researcher with a magnifier",
      "otter coordinator with a lantern",
      "shiba planner with a notebook",
      "turtle auditor with a monocle",
      "chameleon designer with a palette",
      "rabbit scout with a map",
      "penguin operator with a signal flag",
      "fox strategist with a chess token",
      "capybara mentor with a tea cup",
      "raccoon fixer with a toolkit",
      "cat curator with a scroll",
      "deer navigator with a star chart",
      "koala librarian with a book",
      "badger guardian with a shield",
      "whale dreamer with a seashell",
      "hedgehog maker with a gear"
    ],
    "toolStyle": "premium polished soft 3D object render, pure white backdrop, white, lavender and deep-purple palette; a single practical object, no animals, no faces, no text",
    "constraints": "no text, no logos, no watermark, no interface, no real people, no private data",
    "provider": "manual"
  },
  "agents": {
    "featured": []
  },
  "roles": {},
  "brands": {},
  "collector": {
    "roots": {
      "claude": "~/.claude",
      "codex": "~/.codex",
      "sharedSkills": "~/.agents/skills"
    },
    "projectRoots": ["~/Projects"],
    "clis": [
      "claude", "codex", "gemini", "grok", "goose", "aider", "cursor", "gh", "wrangler", "vercel",
      "supabase", "docker", "ffmpeg", "ffprobe", "whisper", "ollama", "uv", "node", "python3"
    ],
    "jobs": {
      "includePatterns": ["*"],
      "excludePatterns": ["com.apple.*"],
      "privatePatterns": []
    },
    "usage": {
      "providers": ["codex", "claude"]
    }
  },
  "sync": {
    "endpoint": "",
    "staleAfterSeconds": 180
  }
}
